{"height":2676,"image":"sprites.png","schemaVersion":1,"sprites":{"BiomeSprite:badlands":{"h":16,"w":16,"x":144,"y":2162},"BiomeSprite:bamboo-jungle":{"h":16,"w":16,"x":160,"y":2162},"BiomeSprite:basalt-deltas":{"h":16,"w":16,"x":176,"y":2162},"BiomeSprite:beach":{"h":16,"w":16,"x":192,"y":2162},"BiomeSprite:birch-forest":{"h":16,"w":16,"x":208,"y":2162},"BiomeSprite:cherry-grove":{"h":16,"w":16,"x":224,"y":2162},"BiomeSprite:cold-ocean":{"h":16,"w":16,"x":240,"y":2162},"BiomeSprite:crimson-forest":{"h":16,"w":16,"x":256,"y":2162},"BiomeSprite:dappled-forest":{"h":16,"w":16,"x":272,"y":2162},"BiomeSprite:dark-forest":{"h":16,"w":16,"x":288,"y":2162},"BiomeSprite:deep-cold-ocean":{"h":16,"w":16,"x":304,"y":2162},"BiomeSprite:deep-dark":{"h":16,"w":16,"x":320,"y":2162},"BiomeSprite:deep-frozen-ocean":{"h":16,"w":16,"x":336,"y":2162},"BiomeSprite:deep-lukewarm-ocean":{"h":16,"w":16,"x":352,"y":2162},"BiomeSprite:deep-ocean":{"h":16,"w":16,"x":368,"y":2162},"BiomeSprite:desert":{"h":16,"w":16,"x":384,"y":2162},"BiomeSprite:dripstone-caves":{"h":16,"w":16,"x":400,"y":2162},"BiomeSprite:end-barrens":{"h":16,"w":16,"x":416,"y":2162},"BiomeSprite:end-highlands":{"h":16,"w":16,"x":432,"y":2162},"BiomeSprite:end-midlands":{"h":16,"w":16,"x":448,"y":2162},"BiomeSprite:eroded-badlands":{"h":16,"w":16,"x":464,"y":2162},"BiomeSprite:flower-forest":{"h":16,"w":16,"x":480,"y":2162},"BiomeSprite:forest":{"h":16,"w":16,"x":496,"y":2162},"BiomeSprite:frozen-ocean":{"h":16,"w":16,"x":0,"y":2180},"BiomeSprite:frozen-peaks":{"h":16,"w":16,"x":16,"y":2180},"BiomeSprite:frozen-river":{"h":16,"w":16,"x":32,"y":2180},"BiomeSprite:grove":{"h":16,"w":16,"x":48,"y":2180},"BiomeSprite:ice-spikes":{"h":16,"w":16,"x":64,"y":2180},"BiomeSprite:jagged-peaks":{"h":16,"w":16,"x":80,"y":2180},"BiomeSprite:jungle":{"h":16,"w":16,"x":96,"y":2180},"BiomeSprite:lukewarm-ocean":{"h":16,"w":16,"x":112,"y":2180},"BiomeSprite:lush-caves":{"h":16,"w":16,"x":128,"y":2180},"BiomeSprite:mangrove-swamp":{"h":16,"w":16,"x":144,"y":2180},"BiomeSprite:meadow":{"h":16,"w":16,"x":160,"y":2180},"BiomeSprite:mushroom-fields":{"h":16,"w":16,"x":176,"y":2180},"BiomeSprite:nether-wastes":{"h":16,"w":16,"x":192,"y":2180},"BiomeSprite:ocean":{"h":16,"w":16,"x":208,"y":2180},"BiomeSprite:old-growth-birch-forest":{"h":16,"w":16,"x":224,"y":2180},"BiomeSprite:old-growth-pine-taiga":{"h":16,"w":16,"x":240,"y":2180},"BiomeSprite:old-growth-spruce-taiga":{"h":16,"w":16,"x":256,"y":2180},"BiomeSprite:pale-garden":{"h":16,"w":16,"x":272,"y":2180},"BiomeSprite:plains":{"h":16,"w":16,"x":288,"y":2180},"BiomeSprite:river":{"h":16,"w":16,"x":304,"y":2180},"BiomeSprite:savanna":{"h":16,"w":16,"x":336,"y":2180},"BiomeSprite:savanna-plateau":{"h":16,"w":16,"x":320,"y":2180},"BiomeSprite:small-end-islands":{"h":16,"w":16,"x":352,"y":2180},"BiomeSprite:snowy-beach":{"h":16,"w":16,"x":368,"y":2180},"BiomeSprite:snowy-plains":{"h":16,"w":16,"x":384,"y":2180},"BiomeSprite:snowy-slopes":{"h":16,"w":16,"x":400,"y":2180},"BiomeSprite:snowy-taiga":{"h":16,"w":16,"x":416,"y":2180},"BiomeSprite:soul-sand-valley":{"h":16,"w":16,"x":432,"y":2180},"BiomeSprite:sparse-jungle":{"h":16,"w":16,"x":448,"y":2180},"BiomeSprite:stony-peaks":{"h":16,"w":16,"x":464,"y":2180},"BiomeSprite:stony-shore":{"h":16,"w":16,"x":480,"y":2180},"BiomeSprite:sulfur-caves":{"h":16,"w":16,"x":496,"y":2180},"BiomeSprite:sunflower-plains":{"h":16,"w":16,"x":0,"y":2196},"BiomeSprite:swamp":{"h":16,"w":16,"x":16,"y":2196},"BiomeSprite:taiga":{"h":16,"w":16,"x":32,"y":2196},"BiomeSprite:the-end":{"h":16,"w":16,"x":48,"y":2196},"BiomeSprite:the-void":{"h":16,"w":16,"x":64,"y":2196},"BiomeSprite:warm-ocean":{"h":16,"w":16,"x":80,"y":2196},"BiomeSprite:warped-forest":{"h":16,"w":16,"x":96,"y":2196},"BiomeSprite:windswept-forest":{"h":16,"w":16,"x":112,"y":2196},"BiomeSprite:windswept-gravelly-hills":{"h":16,"w":16,"x":128,"y":2196},"BiomeSprite:windswept-hills":{"h":16,"w":16,"x":144,"y":2196},"BiomeSprite:windswept-savanna":{"h":16,"w":16,"x":160,"y":2196},"BiomeSprite:wooded-badlands":{"h":16,"w":16,"x":176,"y":2196},"BlockSprite:acacia-wall-hanging-sign":{"h":16,"w":16,"x":192,"y":2196},"BlockSprite:acacia-wall-sign":{"h":16,"w":16,"x":208,"y":2196},"BlockSprite:air":{"h":16,"w":16,"x":224,"y":2196},"BlockSprite:attached-melon-stem":{"h":16,"w":16,"x":240,"y":2196},"BlockSprite:attached-pumpkin-stem":{"h":16,"w":16,"x":256,"y":2196},"BlockSprite:bamboo-sapling":{"h":16,"w":16,"x":272,"y":2196},"BlockSprite:bamboo-wall-hanging-sign":{"h":16,"w":16,"x":288,"y":2196},"BlockSprite:bamboo-wall-sign":{"h":16,"w":16,"x":304,"y":2196},"BlockSprite:big-dripleaf-stem":{"h":16,"w":16,"x":320,"y":2196},"BlockSprite:birch-wall-hanging-sign":{"h":16,"w":16,"x":336,"y":2196},"BlockSprite:birch-wall-sign":{"h":16,"w":16,"x":352,"y":2196},"BlockSprite:black-candle-cake":{"h":16,"w":16,"x":368,"y":2196},"BlockSprite:black-wall-banner":{"h":16,"w":16,"x":384,"y":2196},"BlockSprite:black-wool-slab":{"h":16,"w":16,"x":400,"y":2196},"BlockSprite:blue-candle-cake":{"h":16,"w":16,"x":416,"y":2196},"BlockSprite:blue-wall-banner":{"h":16,"w":16,"x":432,"y":2196},"BlockSprite:blue-wool-slab":{"h":16,"w":16,"x":448,"y":2196},"BlockSprite:blue-wool-stairs":{"h":16,"w":16,"x":464,"y":2196},"BlockSprite:brain-coral-wall-fan":{"h":16,"w":16,"x":480,"y":2196},"BlockSprite:brown-candle-cake":{"h":16,"w":16,"x":496,"y":2196},"BlockSprite:brown-wall-banner":{"h":16,"w":16,"x":0,"y":2212},"BlockSprite:brown-wool-slab":{"h":16,"w":16,"x":16,"y":2212},"BlockSprite:brown-wool-stairs":{"h":16,"w":16,"x":32,"y":2212},"BlockSprite:bubble-coral-wall-fan":{"h":16,"w":16,"x":48,"y":2212},"BlockSprite:candle-cake":{"h":16,"w":16,"x":80,"y":2212},"BlockSprite:cave-vines-plant":{"h":16,"w":16,"x":304,"y":2212},"BlockSprite:cherry-wall-hanging-sign":{"h":16,"w":16,"x":320,"y":2212},"BlockSprite:cherry-wall-sign":{"h":16,"w":16,"x":336,"y":2212},"BlockSprite:copper-wall-torch":{"h":16,"w":16,"x":352,"y":2212},"BlockSprite:creeper-wall-head":{"h":16,"w":16,"x":368,"y":2212},"BlockSprite:crimson-wall-hanging-sign":{"h":16,"w":16,"x":384,"y":2212},"BlockSprite:crimson-wall-sign":{"h":16,"w":16,"x":400,"y":2212},"BlockSprite:cyan-candle-cake":{"h":16,"w":16,"x":96,"y":2212},"BlockSprite:cyan-wall-banner":{"h":16,"w":16,"x":416,"y":2212},"BlockSprite:cyan-wool-slab":{"h":16,"w":16,"x":432,"y":2212},"BlockSprite:cyan-wool-stairs":{"h":16,"w":16,"x":448,"y":2212},"BlockSprite:dark-oak-wall-hanging-sign":{"h":16,"w":16,"x":464,"y":2212},"BlockSprite:dark-oak-wall-sign":{"h":16,"w":16,"x":480,"y":2212},"BlockSprite:dead-brain-coral-wall-fan":{"h":16,"w":16,"x":496,"y":2212},"BlockSprite:dead-bubble-coral-wall-fan":{"h":16,"w":16,"x":0,"y":2228},"BlockSprite:dead-fire-coral-wall-fan":{"h":16,"w":16,"x":16,"y":2228},"BlockSprite:dead-horn-coral-wall-fan":{"h":16,"w":16,"x":32,"y":2228},"BlockSprite:dead-tube-coral-wall-fan":{"h":16,"w":16,"x":48,"y":2228},"BlockSprite:dragon-wall-head":{"h":16,"w":16,"x":64,"y":2228},"BlockSprite:fire-coral-wall-fan":{"h":16,"w":16,"x":80,"y":2228},"BlockSprite:gray-candle-cake":{"h":16,"w":16,"x":112,"y":2212},"BlockSprite:gray-wall-banner":{"h":16,"w":16,"x":96,"y":2228},"BlockSprite:gray-wool-slab":{"h":16,"w":16,"x":112,"y":2228},"BlockSprite:gray-wool-stairs":{"h":16,"w":16,"x":128,"y":2228},"BlockSprite:green-candle-cake":{"h":16,"w":16,"x":128,"y":2212},"BlockSprite:green-wall-banner":{"h":16,"w":16,"x":144,"y":2228},"BlockSprite:green-wool-slab":{"h":16,"w":16,"x":160,"y":2228},"BlockSprite:green-wool-stairs":{"h":16,"w":16,"x":176,"y":2228},"BlockSprite:horn-coral-wall-fan":{"h":16,"w":16,"x":192,"y":2228},"BlockSprite:jigsaw":{"h":16,"w":16,"x":208,"y":2228},"BlockSprite:jungle-wall-hanging-sign":{"h":16,"w":16,"x":224,"y":2228},"BlockSprite:jungle-wall-sign":{"h":16,"w":16,"x":240,"y":2228},"BlockSprite:kelp-plant":{"h":16,"w":16,"x":256,"y":2228},"BlockSprite:lava-cauldron":{"h":16,"w":16,"x":272,"y":2228},"BlockSprite:light-blue-candle-cake":{"h":16,"w":16,"x":144,"y":2212},"BlockSprite:light-blue-wall-banner":{"h":16,"w":16,"x":288,"y":2228},"BlockSprite:light-blue-wool-slab":{"h":16,"w":16,"x":304,"y":2228},"BlockSprite:light-blue-wool-stairs":{"h":16,"w":16,"x":320,"y":2228},"BlockSprite:light-gray-candle-cake":{"h":16,"w":16,"x":160,"y":2212},"BlockSprite:light-gray-wall-banner":{"h":16,"w":16,"x":336,"y":2228},"BlockSprite:light-gray-wool-slab":{"h":16,"w":16,"x":352,"y":2228},"BlockSprite:light-gray-wool-stairs":{"h":16,"w":16,"x":368,"y":2228},"BlockSprite:lime-candle-cake":{"h":16,"w":16,"x":176,"y":2212},"BlockSprite:lime-wall-banner":{"h":16,"w":16,"x":384,"y":2228},"BlockSprite:lime-wool-slab":{"h":16,"w":16,"x":400,"y":2228},"BlockSprite:lime-wool-stairs":{"h":16,"w":16,"x":416,"y":2228},"BlockSprite:magenta-candle-cake":{"h":16,"w":16,"x":192,"y":2212},"BlockSprite:magenta-wall-banner":{"h":16,"w":16,"x":432,"y":2228},"BlockSprite:magenta-wool-slab":{"h":16,"w":16,"x":448,"y":2228},"BlockSprite:magenta-wool-stairs":{"h":16,"w":16,"x":464,"y":2228},"BlockSprite:mangrove-wall-hanging-sign":{"h":16,"w":16,"x":480,"y":2228},"BlockSprite:mangrove-wall-sign":{"h":16,"w":16,"x":496,"y":2228},"BlockSprite:moving-piston":{"h":16,"w":16,"x":0,"y":2244},"BlockSprite:oak-wall-hanging-sign":{"h":16,"w":16,"x":16,"y":2244},"BlockSprite:oak-wall-sign":{"h":16,"w":16,"x":32,"y":2244},"BlockSprite:ominous-banner":{"h":16,"w":16,"x":48,"y":2244},"BlockSprite:orange-candle-cake":{"h":16,"w":16,"x":208,"y":2212},"BlockSprite:orange-poplar-leaves":{"h":16,"w":16,"x":64,"y":2244},"BlockSprite:orange-wall-banner":{"h":16,"w":16,"x":80,"y":2244},"BlockSprite:orange-wool-slab":{"h":16,"w":16,"x":96,"y":2244},"BlockSprite:orange-wool-stairs":{"h":16,"w":16,"x":112,"y":2244},"BlockSprite:pale-oak-wall-hanging-sign":{"h":16,"w":16,"x":128,"y":2244},"BlockSprite:pale-oak-wall-sign":{"h":16,"w":16,"x":144,"y":2244},"BlockSprite:piglin-wall-head":{"h":16,"w":16,"x":160,"y":2244},"BlockSprite:pink-candle-cake":{"h":16,"w":16,"x":224,"y":2212},"BlockSprite:pink-